{
  "$schema": "http://json-schema.org/draft-07/schema#",
  "$id": "https://bigbeartechworld.com/schemas/universal-app-v1.json",
  "title": "Big Bear Universal App Format",
  "description": "Schema for Big Bear Universal App metadata format",
  "type": "object",
  "required": ["spec_version", "metadata", "technical", "deployment"],
  "properties": {
    "spec_version": {
      "type": "string",
      "pattern": "^[0-9]+\\.[0-9]+$",
      "description": "Schema specification version"
    },
    "metadata": {
      "type": "object",
      "required": ["id", "name", "description", "version", "category"],
      "properties": {
        "id": {
          "type": "string",
          "pattern": "^[a-z0-9-]+$",
          "description": "Unique app identifier (lowercase, alphanumeric and hyphens only)"
        },
        "name": {
          "type": "string",
          "minLength": 1,
          "description": "Human-readable app name"
        },
        "description": {
          "type": "string",
          "minLength": 10,
          "description": "Full app description"
        },
        "tagline": {
          "type": "string",
          "description": "Short tagline or subtitle"
        },
        "version": {
          "type": "string",
          "pattern": "^[0-9]+\\.[0-9]+\\.[0-9]+.*$",
          "description": "App version (semver format)"
        },
        "author": {
          "type": "string",
          "description": "Configuration author"
        },
        "developer": {
          "type": "string",
          "description": "Original app developer"
        },
        "category": {
          "type": "string",
          "enum": [
            "Media",
            "Network",
            "Utilities",
            "Security",
            "Productivity",
            "Communication",
            "Development",
            "Smart Home",
            "Gaming",
            "Finance",
            "Education",
            "Health",
            "Entertainment",
            "Analytics",
            "Automation",
            "Backup",
            "Database",
            "Monitoring",
            "Storage",
            "Web",
            "Other",
            "BigBearCasaOS"
          ],
          "description": "App category"
        },
        "license": {
          "type": "string",
          "description": "Software license"
        },
        "homepage": {
          "type": "string",
          "format": "uri",
          "description": "App homepage URL"
        },
        "source": {
          "type": "string",
          "description": "Source repository identifier"
        },
        "created": {
          "type": "string",
          "format": "date-time",
          "description": "Creation timestamp"
        },
        "updated": {
          "type": "string",
          "format": "date-time",
          "description": "Last update timestamp"
        }
      }
    },
    "visual": {
      "type": "object",
      "properties": {
        "icon": {
          "type": "string",
          "format": "uri",
          "description": "App icon URL"
        },
        "thumbnail": {
          "type": "string",
          "format": "uri",
          "description": "App thumbnail URL"
        },
        "screenshots": {
          "type": "array",
          "items": {
            "type": "string",
            "format": "uri"
          },
          "description": "Screenshot URLs"
        },
        "logo": {
          "type": "string",
          "format": "uri",
          "description": "App logo URL"
        }
      }
    },
    "resources": {
      "type": "object",
      "properties": {
        "youtube": {
          "type": "string",
          "description": "YouTube video URL"
        },
        "documentation": {
          "type": "string",
          "format": "uri",
          "description": "Documentation URL"
        },
        "repository": {
          "type": "string",
          "format": "uri",
          "description": "Source code repository URL"
        },
        "issues": {
          "type": "string",
          "format": "uri",
          "description": "Issue tracker URL"
        },
        "support": {
          "type": "string",
          "format": "uri",
          "description": "Support/community URL"
        }
      }
    },
    "technical": {
      "type": "object",
      "required": ["architectures", "main_service", "main_image", "compose_file"],
      "properties": {
        "architectures": {
          "type": "array",
          "items": {
            "type": "string",
            "enum": ["amd64", "arm64", "armv7", "armv6", "i386", "ppc64le", "s390x"]
          },
          "minItems": 1,
          "description": "Supported CPU architectures"
        },
        "platform": {
          "type": "string",
          "enum": ["linux", "windows", "darwin"],
          "description": "Target platform"
        },
        "main_service": {
          "type": "string",
          "description": "Name of the main service in docker-compose.yml"
        },
        "default_port": {
          "type": "string",
          "description": "Default port for web UI"
        },
        "main_image": {
          "type": "string",
          "description": "Main Docker image name (without tag)"
        },
        "compose_file": {
          "type": "string",
          "description": "Docker Compose file name"
        }
      }
    },
    "deployment": {
      "type": "object",
      "properties": {
        "environment_variables": {
          "type": "array",
          "items": {
            "type": "object",
            "required": ["name", "description"],
            "properties": {
              "name": {
                "type": "string",
                "description": "Environment variable name"
              },
              "default": {
                "type": "string",
                "description": "Default value"
              },
              "description": {
                "type": "string",
                "description": "Variable description"
              },
              "required": {
                "type": "boolean",
                "description": "Whether this variable is required"
              }
            }
          }
        },
        "volumes": {
          "type": "array",
          "items": {
            "type": "object",
            "required": ["container", "description"],
            "properties": {
              "container": {
                "type": "string",
                "description": "Container path"
              },
              "description": {
                "type": "string",
                "description": "Volume description"
              }
            }
          }
        },
        "ports": {
          "type": "array",
          "items": {
            "type": "object",
            "required": ["container"],
            "properties": {
              "container": {
                "type": "string",
                "description": "Container port"
              },
              "host": {
                "type": "string",
                "description": "Host port"
              },
              "protocol": {
                "type": "string",
                "enum": ["tcp", "udp"],
                "description": "Port protocol"
              },
              "description": {
                "type": "string",
                "description": "Port description"
              }
            }
          }
        },
        "services": {
          "type": "array",
          "description": "Detailed service information (auto-extracted from docker-compose.yml)"
        },
        "networks": {
          "type": "object",
          "description": "Network configurations (auto-extracted from docker-compose.yml)"
        },
        "volumes_config": {
          "type": "object",
          "description": "Volume configurations (auto-extracted from docker-compose.yml)"
        }
      }
    },
    "ui": {
      "type": "object",
      "properties": {
        "scheme": {
          "type": "string",
          "enum": ["http", "https"],
          "description": "URL scheme for web UI"
        },
        "path": {
          "type": "string",
          "description": "URL path for web UI"
        },
        "tips": {
          "type": "object",
          "description": "Platform-specific tips and hints"
        }
      }
    },
    "compatibility": {
      "type": "object",
      "properties": {
        "casaos": {
          "type": "object",
          "properties": {
            "supported": {
              "type": "boolean"
            },
            "port_map": {
              "type": "string"
            },
            "folder_name": {
              "type": "string",
              "description": "Override folder name in CasaOS repository (defaults to app id)"
            },
            "youtube": {
              "type": "string",
              "description": "Platform-specific YouTube video URL"
            },
            "volume_mappings": {
              "type": "object",
              "description": "Custom volume path mappings to preserve existing CasaOS paths. Maps named volume names to CasaOS bind mount paths (e.g., {'app_data': '/DATA/AppData/$AppID/data'})",
              "additionalProperties": {
                "type": "string"
              }
            }
          }
        },
        "portainer": {
          "type": "object",
          "properties": {
            "supported": {
              "type": "boolean"
            },
            "template_type": {
              "type": "integer",
              "enum": [1, 2, 3]
            },
            "categories": {
              "type": "array",
              "items": {
                "type": "string"
              }
            },
            "administrator_only": {
              "type": "boolean"
            },
            "folder_name": {
              "type": "string",
              "description": "Override folder name in Portainer repository (defaults to app id)"
            },
            "youtube": {
              "type": "string",
              "description": "Platform-specific YouTube video URL"
            }
          }
        },
        "runtipi": {
          "type": "object",
          "properties": {
            "supported": {
              "type": "boolean"
            },
            "port": {
              "type": "string",
              "pattern": "^(?:[1-9]|[1-9][0-9]{1,3}|[1-5][0-9]{4}|6[0-4][0-9]{3}|65[0-4][0-9]{2}|655[0-2][0-9]|6553[0-5])(?![\\s\\S])",
              "description": "Override the host port in Runtipi config.json; the internal routing port is derived from the main service Compose port"
            },
            "tipi_version": {
              "type": "integer"
            },
            "supported_architectures": {
              "type": "array",
              "items": {
                "type": "string"
              }
            },
            "folder_name": {
              "type": "string",
              "description": "Override folder name in Runtipi repository (defaults to app id)"
            },
            "youtube": {
              "type": "string",
              "description": "Platform-specific YouTube video URL"
            },
            "volume_mappings": {
              "type": "object",
              "description": "Custom volume path mappings for Runtipi. Maps named volume names to Runtipi data directory paths (e.g., {'app_data_config': 'data/config'}).",
              "additionalProperties": {
                "type": "string"
              }
            }
          }
        },
        "dockge": {
          "type": "object",
          "properties": {
            "supported": {
              "type": "boolean"
            },
            "file_based": {
              "type": "boolean"
            },
            "folder_name": {
              "type": "string",
              "description": "Override folder name in Dockge repository (defaults to app id)"
            },
            "youtube": {
              "type": "string",
              "description": "Platform-specific YouTube video URL"
            }
          }
        },
        "cosmos": {
          "type": "object",
          "properties": {
            "supported": {
              "type": "boolean"
            },
            "servapp": {
              "type": "boolean"
            },
            "routes_required": {
              "type": "boolean"
            },
            "port": {
              "type": "string",
              "pattern": "^(?:[1-9]|[1-9][0-9]{1,3}|[1-5][0-9]{4}|6[0-4][0-9]{3}|65[0-4][0-9]{2}|655[0-2][0-9]|6553[0-5])(?:\\n(?:[1-9]|[1-9][0-9]{1,3}|[1-5][0-9]{4}|6[0-4][0-9]{3}|65[0-4][0-9]{2}|655[0-2][0-9]|6553[0-5]))*(?![\\s\\S])",
              "description": "Override internal container port for Cosmos route targets; multiple ports may be newline-delimited"
            },
            "folder_name": {
              "type": "string",
              "description": "Override folder name in Cosmos repository (defaults to app id)"
            },
            "youtube": {
              "type": "string",
              "description": "Platform-specific YouTube video URL"
            }
          }
        },
        "umbrel": {
          "type": "object",
          "properties": {
            "supported": {
              "type": "boolean"
            },
            "manifest_version": {
              "type": "integer"
            },
            "folder_name": {
              "type": "string",
              "description": "Override folder name in Umbrel repository (defaults to app id)"
            },
            "youtube": {
              "type": "string",
              "description": "Platform-specific YouTube video URL"
            },
            "port": {
              "type": "string",
              "description": "Override external host port for umbrel-app.yml (skips automatic 10000+ remapping)"
            },
            "app_port": {
              "type": "string",
              "description": "Override internal container port for app_proxy APP_PORT. Use when the app has multiple ports and the UI port differs from the first port in docker-compose.yml"
            },
            "volume_mappings": {
              "type": "object",
              "description": "Custom volume path mappings for Umbrel. Maps named volume names to Umbrel data directory paths (e.g., {'audiobookshelf_media_data_books_spoken': 'media/data/books/spoken'}). Used to preserve backward compatibility with existing Umbrel app structures or specify custom hierarchical paths.",
              "additionalProperties": {
                "type": "string"
              }
            }
          }
        }
      }
    },
    "tags": {
      "type": "array",
      "items": {
        "type": "string"
      },
      "description": "App tags for searchability"
    }
  }
}
