{
  "spec_version": "1.0",
  "metadata": {
    "id": "lancache",
    "name": "LAN Cache",
    "description": "Make the most of your network. Get more play for your gamers. Download your games once and serve them out to many people at your LAN.",
    "tagline": "LAN Party game caching made easy",
    "version": "latest",
    "author": "BigBearTechWorld",
    "developer": "lancachenet",
    "category": "BigBearCasaOS",
    "license": "",
    "homepage": "https://hub.docker.com/r/lancachenet/monolithic",
    "source": "big-bear-universal",
    "created": "2025-10-27T02:41:57Z",
    "updated": "2025-10-27T02:41:57Z"
  },
  "visual": {
    "icon": "https://cdn.jsdelivr.net/gh/selfhst/icons/png/lancache-net.png",
    "thumbnail": "",
    "screenshots": [],
    "logo": "https://cdn.jsdelivr.net/gh/selfhst/icons/png/lancache-net.png"
  },
  "resources": {
    "youtube": "",
    "documentation": "",
    "repository": "",
    "issues": "",
    "support": "https://community.bigbeartechworld.com/"
  },
  "technical": {
    "architectures": [
      "amd64"
    ],
    "platform": "linux",
    "main_service": "app",
    "default_port": "8080",
    "main_image": "lancachenet/monolithic",
    "compose_file": "docker-compose.yml"
  },
  "deployment": {
    "environment_variables": [],
    "volumes": [
      {
        "container": "/data/cache",
        "description": "Container Path: /data/cache"
      },
      {
        "container": "/data/logs",
        "description": "Container Path: /data/logs"
      }
    ],
    "ports": [
      {
        "container": "80",
        "host": "80",
        "protocol": "tcp",
        "description": "Container Port: 80"
      },
      {
        "container": "443",
        "host": "443",
        "protocol": "tcp",
        "description": "Container Port: 443"
      }
    ]
  },
  "ui": {
    "scheme": "http",
    "path": "",
    "tips": {}
  },
  "compatibility": {
    "casaos": {
      "supported": true,
      "port_map": "8080",
      "volume_mappings": {
        "lancache_cache": "/DATA/AppData/$AppID/cache",
        "lancache_logs": "/DATA/AppData/$AppID/logs"
      },
      "port": "8080",
      "category": "Networking"
    },
    "portainer": {
      "supported": true,
      "template_type": 2,
      "categories": [
        "BigBearCasaOS",
        "selfhosted"
      ],
      "administrator_only": false,
      "port": "8080\n53"
    },
    "runtipi": {
      "published_services": ["dns"],
      "supported": true,
      "tipi_version": 1,
      "supported_architectures": [
        "amd64"
      ],
      "volume_mappings": {
        "lancache_cache": "cache",
        "lancache_logs": "logs"
      },
      "port": "8105"
    },
    "dockge": {
      "supported": true,
      "file_based": true,
      "port": "8080\n53"
    },
    "cosmos": {
      "supported": true,
      "servapp": true,
      "routes_required": true,
      "port": "8080\n53"
    },
    "umbrel": {
      "supported": true,
      "manifest_version": 1,
      "volume_mappings": {
        "lancache_cache": "cache",
        "lancache_logs": "logs"
      },
      "port": "10085"
    }
  },
  "tags": [
    "selfhosted",
    "docker",
    "bigbear",
    "bigbearcasaos",
    "container"
  ]
}
