{
  "spec_version": "1.0",
  "metadata": {
    "id": "dozzle",
    "name": "Dozzle",
    "description": "Dozzle is a real-time log viewer for docker containers.",
    "tagline": "Dozzle is a real-time log viewer for docker containers.",
    "version": "v11.3.4",
    "author": "BigBearTechWorld",
    "developer": "amir20",
    "category": "BigBearCasaOS",
    "license": "",
    "homepage": "https://hub.docker.com/r/amir20/dozzle",
    "source": "big-bear-universal",
    "created": "2025-10-27T02:41:45Z",
    "updated": "2026-10-23T23:27:14.308Z"
  },
  "visual": {
    "icon": "https://cdn.jsdelivr.net/gh/bigbeartechworld/big-bear-universal-apps/apps/dozzle/logo.png",
    "thumbnail": "",
    "screenshots": [],
    "logo": "https://cdn.jsdelivr.net/gh/bigbeartechworld/big-bear-universal-apps/apps/dozzle/logo.png"
  },
  "resources": {
    "youtube": "https://youtu.be/lLLNDcHNOuM",
    "documentation": "",
    "repository": "",
    "issues": "",
    "support": "https://community.bigbeartechworld.com/"
  },
  "technical": {
    "architectures": [
      "amd64",
      "arm64"
    ],
    "platform": "linux",
    "main_service": "app",
    "default_port": "8888",
    "main_image": "amir20/dozzle",
    "compose_file": "docker-compose.yml"
  },
  "deployment": {
    "environment_variables": [],
    "volumes": [
      {
        "container": "/var/run/docker.sock",
        "description": "Container Path: /var/run/docker.sock"
      }
    ],
    "ports": [
      {
        "container": "8080",
        "host": "8080",
        "protocol": "tcp",
        "description": "Container Port: 8080"
      }
    ]
  },
  "ui": {
    "scheme": "http",
    "path": "",
    "tips": {}
  },
  "compatibility": {
    "casaos": {
      "supported": true,
      "port_map": "8888",
      "port": "8888",
      "category": "Developer"
    },
    "portainer": {
      "supported": true,
      "template_type": 2,
      "categories": [
        "BigBearCasaOS",
        "selfhosted"
      ],
      "administrator_only": false,
      "port": "8888"
    },
    "runtipi": {
      "supported": true,
      "tipi_version": 1,
      "supported_architectures": [
        "amd64",
        "arm64"
      ],
      "port": "8888"
    },
    "dockge": {
      "supported": true,
      "file_based": true,
      "port": "8888"
    },
    "cosmos": {
      "supported": true,
      "servapp": true,
      "routes_required": true,
      "port": "8888"
    },
    "umbrel": {
      "supported": true,
      "manifest_version": 1,
      "port": "10039"
    }
  },
  "tags": [
    "selfhosted",
    "docker",
    "bigbear",
    "bigbearcasaos",
    "container"
  ]
}
