{
  "spec_version": "1.0",
  "metadata": {
    "id": "ffmpeg",
    "name": "Ffmpeg",
    "description": "This container needs special attention. Please check https://hub.docker.com/r/linuxserver/ffmpeg for details.",
    "tagline": "This container needs special attention. Please check https://hub. Docker. Com/r/linuxserver/ffmpeg for details.",
    "version": "9.0.2",
    "author": "WisdomSky",
    "developer": "LinuxServer.io",
    "category": "Smart Home",
    "license": "",
    "homepage": "https://hub.docker.com/r/linuxserver/ffmpeg",
    "source": "linuxserver-appstore",
    "created": "2026-09-17T18:10:58.711Z",
    "updated": "2026-10-13T16:36:53.527Z"
  },
  "visual": {
    "icon": "https://cdn.jsdelivr.net/gh/linuxserver/docker-templates@master/linuxserver.io/img/ffmpeg.png",
    "thumbnail": "https://cdn.jsdelivr.net/gh/linuxserver/docker-templates@master/linuxserver.io/img/ffmpeg.png",
    "screenshots": [],
    "logo": "https://cdn.jsdelivr.net/gh/linuxserver/docker-templates@master/linuxserver.io/img/ffmpeg.png"
  },
  "resources": {
    "youtube": "",
    "documentation": "",
    "repository": "https://github.com/linuxserver/docker-ffmpeg",
    "issues": "",
    "support": "https://www.linuxserver.io/"
  },
  "technical": {
    "architectures": [
      "amd64",
      "arm64"
    ],
    "platform": "linux",
    "main_service": "app",
    "default_port": "80",
    "main_image": "linuxserver/ffmpeg",
    "compose_file": "docker-compose.yml"
  },
  "deployment": {
    "environment_variables": [
      {
        "name": "PUID",
        "default": "",
        "description": "Container Variable: PUID",
        "required": false
      },
      {
        "name": "PGID",
        "default": "",
        "description": "Container Variable: PGID",
        "required": false
      },
      {
        "name": "TZ",
        "default": "",
        "description": "Container Variable: TZ",
        "required": false
      }
    ],
    "volumes": [
      {
        "container": "/config",
        "description": "Container Path: /config"
      }
    ],
    "ports": [
      {
        "container": "80",
        "host": "80",
        "protocol": "tcp"
      }
    ]
  },
  "ui": {
    "scheme": "http",
    "path": "",
    "tips": {}
  },
  "compatibility": {
    "casaos": {
      "supported": true,
      "port": "80",
      "category": "Home"
    },
    "portainer": {
      "supported": true,
      "port": "80"
    },
    "runtipi": {
      "supported": true,
      "port": "80"
    },
    "dockge": {
      "supported": true,
      "port": "80"
    },
    "cosmos": {
      "supported": true,
      "port": "80"
    },
    "umbrel": {
      "supported": true,
      "port": "80"
    }
  },
  "tags": [
    "selfhosted",
    "docker",
    "linuxserver",
    "linuxserver-appstore"
  ]
}
