{
  "spec_version": "1.0",
  "metadata": {
    "id": "manyfold",
    "name": "Manyfold",
    "description": "Manyfold is an open source, self-hosted web application for managing a collection of 3D models, particularly focused on 3D printing.",
    "tagline": "An open source, self-hosted web application for managing a collection of 3D models, particularly focused on 3D printing.",
    "version": "0.150.0",
    "author": "WisdomSky",
    "developer": "LinuxServer.io",
    "category": "Smart Home",
    "license": "",
    "homepage": "https://hub.docker.com/r/linuxserver/manyfold",
    "source": "linuxserver-appstore",
    "created": "2026-09-17T18:10:57.314Z",
    "updated": "2026-10-06T04:32:56.607Z"
  },
  "visual": {
    "icon": "https://cdn.jsdelivr.net/gh/selfhst/icons/png/manyfold.png",
    "thumbnail": "https://cdn.jsdelivr.net/gh/selfhst/icons/png/manyfold.png",
    "screenshots": [],
    "logo": "https://cdn.jsdelivr.net/gh/selfhst/icons/png/manyfold.png"
  },
  "resources": {
    "youtube": "",
    "documentation": "",
    "repository": "https://github.com/linuxserver/docker-manyfold",
    "issues": "",
    "support": "https://www.linuxserver.io/"
  },
  "technical": {
    "architectures": [
      "amd64",
      "arm64"
    ],
    "platform": "linux",
    "main_service": "app",
    "default_port": "3214",
    "main_image": "linuxserver/manyfold",
    "compose_file": "docker-compose.yml"
  },
  "deployment": {
    "environment_variables": [
      {
        "name": "PUID",
        "default": "",
        "description": "Container Variable: PUID",
        "required": false
      },
      {
        "name": "PGID",
        "default": "",
        "description": "Container Variable: PGID",
        "required": false
      },
      {
        "name": "TZ",
        "default": "",
        "description": "Container Variable: TZ",
        "required": false
      },
      {
        "name": "DATABASE_URL",
        "default": "",
        "description": "Container Variable: DATABASE_URL",
        "required": false
      },
      {
        "name": "REDIS_URL",
        "default": "",
        "description": "Container Variable: REDIS_URL",
        "required": false
      },
      {
        "name": "SECRET_KEY_BASE",
        "default": "",
        "description": "Container Variable: SECRET_KEY_BASE",
        "required": false
      }
    ],
    "volumes": [
      {
        "container": "/config",
        "description": "Container Path: /config"
      },
      {
        "container": "/libraries",
        "description": "Container Path: /libraries"
      }
    ],
    "ports": [
      {
        "container": "3214",
        "host": "3214",
        "protocol": "tcp"
      }
    ]
  },
  "ui": {
    "scheme": "http",
    "path": "",
    "tips": {}
  },
  "compatibility": {
    "casaos": {
      "supported": true,
      "port": "3214",
      "category": "Home"
    },
    "portainer": {
      "supported": true,
      "port": "3214"
    },
    "runtipi": {
      "supported": true,
      "port": "3214"
    },
    "dockge": {
      "supported": true,
      "port": "3214"
    },
    "cosmos": {
      "supported": true,
      "port": "3214"
    },
    "umbrel": {
      "supported": true,
      "port": "3214"
    }
  },
  "tags": [
    "selfhosted",
    "docker",
    "linuxserver",
    "linuxserver-appstore"
  ]
}
