{
  "spec_version": "1.0",
  "metadata": {
    "id": "dogwalk",
    "name": "Dogwalk",
    "description": "DOGWALK is Blender Studio's long awaited second game project, focused on creating a bite-sized interactive storytelling playground. Play as a big adorable dog and explore the winter woods with a little kid.",
    "tagline": "Blender Studio's long awaited second game project, focused on creating a bite-sized interactive storytelling playground. Play as a big adorable dog and explore the winter woods with a little kid.",
    "version": "0.0.0",
    "author": "WisdomSky",
    "developer": "LinuxServer.io",
    "category": "Smart Home",
    "license": "",
    "homepage": "https://hub.docker.com/r/linuxserver/dogwalk",
    "source": "linuxserver-appstore",
    "created": "2026-09-17T18:10:58.188Z",
    "updated": "2026-09-17T18:10:58.188Z"
  },
  "visual": {
    "icon": "https://cdn.jsdelivr.net/gh/linuxserver/docker-templates@master/linuxserver.io/img/dogwalk-logo.png",
    "thumbnail": "https://cdn.jsdelivr.net/gh/linuxserver/docker-templates@master/linuxserver.io/img/dogwalk-logo.png",
    "screenshots": [],
    "logo": "https://cdn.jsdelivr.net/gh/linuxserver/docker-templates@master/linuxserver.io/img/dogwalk-logo.png"
  },
  "resources": {
    "youtube": "",
    "documentation": "",
    "repository": "https://github.com/linuxserver/docker-${id}",
    "issues": "",
    "support": "https://www.linuxserver.io/"
  },
  "technical": {
    "architectures": [
      "amd64"
    ],
    "platform": "linux",
    "main_service": "app",
    "default_port": "3000",
    "main_image": "linuxserver/dogwalk",
    "compose_file": "docker-compose.yml"
  },
  "deployment": {
    "environment_variables": [
      {
        "name": "PUID",
        "default": "",
        "description": "Container Variable: PUID",
        "required": false
      },
      {
        "name": "PGID",
        "default": "",
        "description": "Container Variable: PGID",
        "required": false
      },
      {
        "name": "TZ",
        "default": "",
        "description": "Container Variable: TZ",
        "required": false
      }
    ],
    "volumes": [
      {
        "container": "/config",
        "description": "Container Path: /config"
      }
    ],
    "ports": [
      {
        "container": "3000",
        "host": "3000",
        "protocol": "tcp"
      },
      {
        "container": "3001",
        "host": "3001",
        "protocol": "tcp"
      }
    ]
  },
  "ui": {
    "scheme": "http",
    "path": "",
    "tips": {}
  },
  "compatibility": {
    "casaos": {
      "supported": true,
      "port": "3000",
      "category": "Home"
    },
    "portainer": {
      "supported": true,
      "port": "3000"
    },
    "runtipi": {
      "supported": true,
      "port": "3000"
    },
    "dockge": {
      "supported": true,
      "port": "3000"
    },
    "cosmos": {
      "supported": true,
      "port": "3000"
    },
    "umbrel": {
      "supported": true,
      "port": "3000"
    }
  },
  "tags": [
    "selfhosted",
    "docker",
    "linuxserver",
    "linuxserver-appstore"
  ]
}
