{
  "spec_version": "1.0",
  "metadata": {
    "id": "mailpit",
    "name": "Mailpit",
    "description": "Mailpit is a multi-platform email testing tool & API for developers.",
    "tagline": "Mailpit",
    "version": "v1.32",
    "author": "BigBearTechWorld",
    "developer": "axllent",
    "category": "BigBearCasaOS",
    "license": "",
    "homepage": "https://hub.docker.com/r/axllent/mailpit",
    "source": "big-bear-universal",
    "created": "2025-10-27T02:41:59Z",
    "updated": "2026-10-26T00:47:15.797Z"
  },
  "visual": {
    "icon": "https://cdn.jsdelivr.net/gh/bigbeartechworld/big-bear-universal-apps/apps/mailpit/logo.png",
    "thumbnail": "https://cdn.jsdelivr.net/gh/bigbeartechworld/big-bear-universal-apps/apps/mailpit/logo.png",
    "screenshots": [],
    "logo": "https://cdn.jsdelivr.net/gh/bigbeartechworld/big-bear-universal-apps/apps/mailpit/logo.png"
  },
  "resources": {
    "youtube": "https://youtu.be/2MY3S6csrVw",
    "documentation": "",
    "repository": "",
    "issues": "",
    "support": "https://community.bigbeartechworld.com/"
  },
  "technical": {
    "architectures": [
      "amd64",
      "arm64"
    ],
    "platform": "linux",
    "main_service": "app",
    "default_port": "8025",
    "main_image": "axllent/mailpit",
    "compose_file": "docker-compose.yml"
  },
  "deployment": {
    "environment_variables": [
      {
        "name": "TZ",
        "default": "",
        "description": "Timezone",
        "required": false
      }
    ],
    "volumes": [
      {
        "container": "/data",
        "description": "Container Path: /data"
      }
    ],
    "ports": [
      {
        "container": "8025",
        "host": "8025",
        "protocol": "tcp",
        "description": "Container Port: 8025"
      }
    ]
  },
  "ui": {
    "scheme": "http",
    "path": "",
    "tips": {}
  },
  "compatibility": {
    "casaos": {
      "supported": true,
      "port_map": "8025",
      "volume_mappings": {
        "mailpit_data": "/DATA/AppData/$AppID/data"
      },
      "port": "8025",
      "category": "Developer"
    },
    "portainer": {
      "supported": true,
      "template_type": 2,
      "categories": [
        "BigBearCasaOS",
        "selfhosted"
      ],
      "administrator_only": false,
      "port": "8025"
    },
    "runtipi": {
      "additional_ports": [
        "1025/tcp"
      ],
      "supported": true,
      "tipi_version": 1,
      "supported_architectures": [
        "amd64",
        "arm64"
      ],
      "volume_mappings": {
        "mailpit_data": "data"
      },
      "port": "8025"
    },
    "dockge": {
      "supported": true,
      "file_based": true,
      "port": "8025"
    },
    "cosmos": {
      "supported": true,
      "servapp": true,
      "routes_required": true,
      "port": "8025"
    },
    "umbrel": {
      "supported": true,
      "manifest_version": 1,
      "volume_mappings": {
        "mailpit_data": "data"
      },
      "port": "10093"
    }
  },
  "tags": [
    "selfhosted",
    "docker",
    "bigbear",
    "bigbearcasaos",
    "container"
  ]
}
