{
  "spec_version": "1.0",
  "metadata": {
    "id": "budibase",
    "name": "Budibase",
    "description": "Low code platform for creating internal tools, workflows, and admin panels in minutes. Supports PostgreSQL, MySQL, MSSQL, MongoDB, Rest API, Docker, K8s, and more 🚀. Budibase, the low code platform you'll enjoy using ⚡",
    "tagline": "Internal tools made easy.",
    "version": "v3.49.0",
    "author": "BigBearTechWorld",
    "developer": "Budibase",
    "category": "BigBearCasaOS",
    "license": "",
    "homepage": "https://hub.docker.com/r/budibase/budibase",
    "source": "big-bear-universal",
    "created": "2025-10-27T02:41:39Z",
    "updated": "2026-10-15T09:16:12.048Z"
  },
  "visual": {
    "icon": "https://cdn.jsdelivr.net/gh/selfhst/icons/png/budibase.png",
    "thumbnail": "",
    "screenshots": [],
    "logo": "https://cdn.jsdelivr.net/gh/selfhst/icons/png/budibase.png"
  },
  "resources": {
    "youtube": "",
    "documentation": "",
    "repository": "",
    "issues": "",
    "support": "https://community.bigbeartechworld.com/"
  },
  "technical": {
    "architectures": [
      "amd64",
      "arm64"
    ],
    "platform": "linux",
    "main_service": "big-bear-budibase",
    "default_port": "8080",
    "main_image": "budibase/budibase",
    "compose_file": "docker-compose.yml"
  },
  "deployment": {
    "environment_variables": [],
    "volumes": [
      {
        "container": "/data",
        "description": "Container Path: /data"
      }
    ],
    "ports": [
      {
        "container": "80",
        "host": "80",
        "protocol": "tcp",
        "description": "Container Port: 80"
      }
    ]
  },
  "ui": {
    "scheme": "http",
    "path": "",
    "tips": {}
  },
  "compatibility": {
    "casaos": {
      "supported": true,
      "port_map": "8080",
      "volume_mappings": {
        "budibase_data": "/DATA/AppData/$AppID/data"
      },
      "port": "8080",
      "category": "Developer"
    },
    "portainer": {
      "supported": true,
      "template_type": 2,
      "categories": [
        "BigBearCasaOS",
        "selfhosted"
      ],
      "administrator_only": false,
      "port": "8080"
    },
    "runtipi": {
      "supported": true,
      "tipi_version": 1,
      "supported_architectures": [
        "amd64",
        "arm64"
      ],
      "volume_mappings": {
        "budibase_data": "data"
      },
      "port": "8085"
    },
    "dockge": {
      "supported": true,
      "file_based": true,
      "port": "8080"
    },
    "cosmos": {
      "supported": true,
      "servapp": true,
      "routes_required": true,
      "port": "8080"
    },
    "umbrel": {
      "supported": true,
      "manifest_version": 1,
      "volume_mappings": {
        "budibase_data": "data"
      },
      "port": "10016"
    }
  },
  "tags": [
    "selfhosted",
    "docker",
    "bigbear",
    "bigbearcasaos",
    "container"
  ]
}
