{
  "spec_version": "1.0",
  "metadata": {
    "id": "cops",
    "name": "Cops",
    "description": "Cops by Sébastien Lucas, now maintained by MikesPub, stands for Calibre OPDS (and HTML) Php Server. COPS links to your Calibre library database and allows downloading and emailing of books directly from a web browser and provides a OPDS feed to connect to your devices. Changes in your Calibre library are reflected immediately in your COPS pages. See : COPS's home for more details. Don't forget to check the Wiki. ## Why? (taken from the author's site) In my opinion Calibre is a marvelous tool but is too big and has too much dependencies to be used for its content server. That's the main reason why I coded this OPDS server. I needed a simple tool to be installed on a small server (Seagate Dockstar in my case). I initially thought of Calibre2OPDS but as it generate static file no search was possible. Later I added an simple HTML catalog that should be usable on my Kobo. So COPS's main advantages are : * No need for many dependencies. * No need for a lot of CPU or RAM. * Not much code. * Search is available. * With Dropbox / owncloud it's very easy to have an up to date OPDS server. * It was fun to code. If you want to use the OPDS feed don't forget to specify /feed at the end of your URL.",
    "tagline": "By Sébastien Lucas, now maintained by MikesPub, stands for Calibre OPDS (and HTML) Php Server. COPS links to your Calibre library database and allows downloading and emailing of books directly from a web browser and provides a OPDS feed to connect to your devices. Changes in your Calibre library are reflected immediately in your COPS pages. See : COPS's home for more details. Don't forget to check the Wiki. ## Why. (taken from the author's site) In my opinion Calibre is a marvelous tool but is too big and has too much dependencies to be used for its content server. That's the main reason why I coded this OPDS server. I needed a simple tool to be installed on a small server (Seagate Dockstar in my case). I initially thought of Calibre2OPDS but as it generate static file no search was possible. Later I added an simple HTML catalog that should be usable on my Kobo. So COPS's main advantages are : * No need for many dependencies. * No need for a lot of CPU or RAM. * Not much code. * Search is available. * With Dropbox / owncloud it's very easy to have an up to date OPDS server. * It was fun to code. If you want to use the OPDS feed don't forget to specify /feed at the end of your URL.",
    "version": "4.6.1",
    "author": "WisdomSky",
    "developer": "LinuxServer.io",
    "category": "Smart Home",
    "license": "",
    "homepage": "https://hub.docker.com/r/linuxserver/cops",
    "source": "linuxserver-appstore",
    "created": "2026-09-17T18:10:58.120Z",
    "updated": "2026-10-29T21:55:39.603Z"
  },
  "visual": {
    "icon": "https://cdn.jsdelivr.net/gh/linuxserver/docker-templates@master/linuxserver.io/img/cops-icon.png",
    "thumbnail": "https://cdn.jsdelivr.net/gh/linuxserver/docker-templates@master/linuxserver.io/img/cops-icon.png",
    "screenshots": [],
    "logo": "https://cdn.jsdelivr.net/gh/linuxserver/docker-templates@master/linuxserver.io/img/cops-icon.png"
  },
  "resources": {
    "youtube": "",
    "documentation": "",
    "repository": "https://github.com/linuxserver/docker-cops",
    "issues": "",
    "support": "https://www.linuxserver.io/"
  },
  "technical": {
    "architectures": [
      "amd64",
      "arm64"
    ],
    "platform": "linux",
    "main_service": "app",
    "default_port": "80",
    "main_image": "linuxserver/cops",
    "compose_file": "docker-compose.yml"
  },
  "deployment": {
    "environment_variables": [
      {
        "name": "PUID",
        "default": "",
        "description": "Container Variable: PUID",
        "required": false
      },
      {
        "name": "PGID",
        "default": "",
        "description": "Container Variable: PGID",
        "required": false
      },
      {
        "name": "TZ",
        "default": "",
        "description": "Container Variable: TZ",
        "required": false
      }
    ],
    "volumes": [
      {
        "container": "/config",
        "description": "Container Path: /config"
      },
      {
        "container": "/books",
        "description": "Container Path: /books"
      }
    ],
    "ports": [
      {
        "container": "80",
        "host": "80",
        "protocol": "tcp"
      },
      {
        "container": "443",
        "host": "443",
        "protocol": "tcp"
      }
    ]
  },
  "ui": {
    "scheme": "http",
    "path": "",
    "tips": {}
  },
  "compatibility": {
    "casaos": {
      "supported": true,
      "port": "80",
      "category": "Home"
    },
    "portainer": {
      "supported": true,
      "port": "80"
    },
    "runtipi": {
      "supported": true,
      "port": "80"
    },
    "dockge": {
      "supported": true,
      "port": "80"
    },
    "cosmos": {
      "supported": true,
      "port": "80"
    },
    "umbrel": {
      "supported": true,
      "port": "80"
    }
  },
  "tags": [
    "selfhosted",
    "docker",
    "linuxserver",
    "linuxserver-appstore"
  ]
}
